ID,Nation,Title,Name,URL
1344,Türkiye,Turkey Central Government Debt Stock,turkish central government debt stock,https://www.investing.com/economic-calendar/turkish-central-government-debt-stock-1344
1353,Hungary,Hungary Current Account (EUR) QoQ,hungarian current account balance (eur),https://www.investing.com/economic-calendar/hungarian-current-account-balance-(eur)-1353
1359,India,India Federal Fiscal Deficit,indian federal fiscal deficit,https://www.investing.com/economic-calendar/indian-federal-fiscal-deficit-1359
1362,Mexico,Mexico Fiscal Balance,mexican fiscal balance,https://www.investing.com/economic-calendar/mexican-fiscal-balance-1362
1364,Czech Republic,Czech Republic Foreign Debt (EUR),czech foreign debt (eur),https://www.investing.com/economic-calendar/czech-foreign-debt-(eur)-1364
1372,Greece,Greece Current Account YoY,greek cbank current account,https://www.investing.com/economic-calendar/greek-cbank-current-account-1372
1385,Slovakia,Slovakia Current Account,slovak current account balance,https://www.investing.com/economic-calendar/slovak-current-account-balance-1385
1391,Colombia,Colombia Trade Balance (USD),colombian trade balance (usd),https://www.investing.com/economic-calendar/colombian-trade-balance-(usd)-1391
1393,Mexico,Mexico Trade Balance (USD),mexican trade balance (usd),https://www.investing.com/economic-calendar/mexican-trade-balance-(usd)-1393
1396,Indonesia,Indonesia Deposit Facility Rate,indonesian deposit facility rate,https://www.investing.com/economic-calendar/indonesian-deposit-facility-rate-1396
1397,Indonesia,Indonesia Lending Facility Rate,indonesian lending facility rate,https://www.investing.com/economic-calendar/indonesian-lending-facility-rate-1397
1398,Norway,Norway Central Bank Currency Purchase,norwegian central bank currency purchase,https://www.investing.com/economic-calendar/norwegian-central-bank-currency-purchase-1398
1407,New Zealand,Reserve Bank of New Zealand (RBNZ) Offshore Holdings,rbnz offshore holdings,https://www.investing.com/economic-calendar/rbnz-offshore-holdings-1407
1409,Brazil,Brazil Long Term Interest Rate TJLP,brazil long term interest rate tjlp,https://www.investing.com/economic-calendar/brazil-long-term-interest-rate-tjlp-1409
1412,Finland,Finland Consumer Confidence,finnish consumer confidence,https://www.investing.com/economic-calendar/finnish-consumer-confidence-1412
1413,Finland,Finland Industrial Confidence,finnish industry confidence,https://www.investing.com/economic-calendar/finnish-industry-confidence-1413
1416,Sweden,Sweden Manufacturing Confidence,swedish manufacturing confidence,https://www.investing.com/economic-calendar/swedish-manufacturing-confidence-1416
1418,Euro Zone,European Services Sentiment,european services sentiment,https://www.investing.com/economic-calendar/european-services-sentiment-1418
1419,Kuwait,Kuwait Bank Lending YoY,kuwait private bank lending,https://www.investing.com/economic-calendar/kuwait-private-bank-lending-1419
1420,Norway,Norway Credit Indicator YoY,norwegian credit indicator,https://www.investing.com/economic-calendar/norwegian-credit-indicator-1420
1421,India,India Deposit Growth,indian deposit growth,https://www.investing.com/economic-calendar/indian-deposit-growth-1421
1423,Australia,Australia Housing Credit,housing credit,https://www.investing.com/economic-calendar/housing-credit-1423
1426,Indonesia,Indonesia Loans,indonesian loans,https://www.investing.com/economic-calendar/indonesian-loans-1426
1427,United States,United States Mortgage Market Index,mortgage market index,https://www.investing.com/economic-calendar/mortgage-market-index-1427
1428,United States,United States Mortgage Refinance Index,mortgage refinance index,https://www.investing.com/economic-calendar/mortgage-refinance-index-1428
1429,Bahrain,Bahrain Private Sector Credit,bahrain private sector credit,https://www.investing.com/economic-calendar/bahrain-private-sector-credit-1429
1430,South Africa,South Africa Private Sector Credit,south african private sector credit extension,https://www.investing.com/economic-calendar/south-african-private-sector-credit-extension-1430
1432,United Kingdom,United Kingdom Public Sector Net Cash Requirement,public sector net cash requirement,https://www.investing.com/economic-calendar/public-sector-net-cash-requirement-1432
1433,Oman,Oman Total Credit YoY,oman total credit,https://www.investing.com/economic-calendar/oman-total-credit-1433
1434,Qatar,Qatar Total Credit YoY,qatar total credit,https://www.investing.com/economic-calendar/qatar-total-credit-1434
1435,Mexico,Mexico Aggregate Demand QoQ,mexican aggregate demand,https://www.investing.com/economic-calendar/mexican-aggregate-demand-1435
1436,Mexico,Mexico Aggregate Demand YoY,mexican aggregate demand,https://www.investing.com/economic-calendar/mexican-aggregate-demand-1436
1439,United Kingdom,United Kingdom Business Investment YoY,business investment,https://www.investing.com/economic-calendar/business-investment-1439
1444,United States,United States Dallas Fed Services Revenues,dallas fed services revenues,https://www.investing.com/economic-calendar/dallas-fed-services-revenues-1444
1446,United States,United States Durables Excluding Defense MoM,durables excluding defense,https://www.investing.com/economic-calendar/durables-excluding-defense-1446
1451,Japan,Japan Foreign Investments in Japanese Stocks,foreign investments in japanese stocks,https://www.investing.com/economic-calendar/foreign-investments-in-japanese-stocks-1451
1467,Botswana,Botswana GDP Quarterly,botswana gdp quarterly,https://www.investing.com/economic-calendar/botswana-gdp-quarterly-1467
1468,United States,United States Gross Domestic Product (GDP) Sales,gdp sales,https://www.investing.com/economic-calendar/gdp-sales-1468
1489,Latvia,Latvia Retail Sales MoM,latvia retail sales,https://www.investing.com/economic-calendar/latvia-retail-sales-1489
1490,Latvia,Latvia Retail Sales YoY,latvia retail sales,https://www.investing.com/economic-calendar/latvia-retail-sales-1490
1494,United States,United States MBA Purchase Index,mba purchase index,https://www.investing.com/economic-calendar/mba-purchase-index-1494
1497,New Zealand,National Bank of New Zealand (NBNZ) Own Activity,nbnz own activity,https://www.investing.com/economic-calendar/nbnz-own-activity-1497
1509,Japan,Japan Reuters Tankan Index,reuters tankan index,https://www.investing.com/economic-calendar/reuters-tankan-index-1509
1510,United States,United States Richmond Manufacturing Shipments,richmond manufacturing shipments,https://www.investing.com/economic-calendar/richmond-manufacturing-shipments-1510
1511,United States,United States Richmond Services Index,richmond services index,https://www.investing.com/economic-calendar/richmond-services-index-1511
1519,United States,United States Texas Services Sector Outlook,texas services sector outlook,https://www.investing.com/economic-calendar/texas-services-sector-outlook-1519
1522,Austria,Austria Unemployment Change,austrian unemployment,https://www.investing.com/economic-calendar/austrian-unemployment-1522
1523,Brazil,Brazil CAGED Net Payroll Jobs,brazilian caged net payroll jobs,https://www.investing.com/economic-calendar/brazilian-caged-net-payroll-jobs-1523
1525,Poland,Poland Employment Growth YoY,polish employment growth,https://www.investing.com/economic-calendar/polish-employment-growth-1525
1527,Germany,Germany Unemployment,german unemployment total,https://www.investing.com/economic-calendar/german-unemployment-total-1527
1528,Germany,Germany Unemployment n.s.a.,german unemployment total n.s.a.,https://www.investing.com/economic-calendar/german-unemployment-total-n.s.a.-1528
1535,Slovakia,Slovakia Unemployment Rate,slovak unemployment rate,https://www.investing.com/economic-calendar/slovak-unemployment-rate-1535
1537,Norway,Norway Unemployment Change,norwegian registered unemployment,https://www.investing.com/economic-calendar/norwegian-registered-unemployment-1537
1538,Colombia,Colombia Urban Unemployment Rate,colombian urban unemployment rate,https://www.investing.com/economic-calendar/colombian-urban-unemployment-rate-1538
1544,Austria,Austria Manufacturing Purchasing Managers Index (PMI),austrian manufacturing pmi,https://www.investing.com/economic-calendar/austrian-manufacturing-pmi-1544
1548,United States,United States Core PCE Prices,core pce prices,https://www.investing.com/economic-calendar/core-pce-prices-1548
1550,United States,United States Dallas Federal Reserve PCE,dallas fed pce,https://www.investing.com/economic-calendar/dallas-fed-pce-1550
1552,Finland,Finland Export Price Index YoY,finnish export prices,https://www.investing.com/economic-calendar/finnish-export-prices-1552
1553,Finland,Finland Import Price Index YoY,finnish import prices,https://www.investing.com/economic-calendar/finnish-import-prices-1553
1555,Germany,Germany Harmonised Index of Consumer Prices (HICP) MoM,german hicp,https://www.investing.com/economic-calendar/german-hicp-1555
1556,Germany,Germany Harmonised Index of Consumer Prices (HICP) YoY,german hicp,https://www.investing.com/economic-calendar/german-hicp-1556
1557,Germany,Germany Import Price Index YoY,german import prices,https://www.investing.com/economic-calendar/german-import-prices-1557
1559,Hungary,Hungary Gross Wages YoY,hungarian gross wages,https://www.investing.com/economic-calendar/hungarian-gross-wages-1559
1561,Brazil,Brazil IGP-M Inflation Index MoM,brazilian igp m inflation index,https://www.investing.com/economic-calendar/brazilian-igp-m-inflation-index-1561
1563,Ireland,Ireland Harmonised Index of Consumer Prices (HICP) MoM,irish hicp,https://www.investing.com/economic-calendar/irish-hicp-1563
1564,Ireland,Ireland Harmonised Index of Consumer Prices (HICP) YoY,irish hicp,https://www.investing.com/economic-calendar/irish-hicp-1564
1566,Latvia,Latvia Producer Price Index (PPI) MoM,latvia ppi,https://www.investing.com/economic-calendar/latvia-ppi-1566
1567,Latvia,Latvia Producer Price Index (PPI) YoY,latvia ppi,https://www.investing.com/economic-calendar/latvia-ppi-1567
1568,United States,United States Michigan 5-Year Inflation Expectations,michigan 5 year inflation expectations,https://www.investing.com/economic-calendar/michigan-5-year-inflation-expectations-1568
1569,Brazil,Brazil Mid-Month Consumer Price Index (CPI) MoM,brazilian mid month cpi,https://www.investing.com/economic-calendar/brazilian-mid-month-cpi-1569
1570,Brazil,Brazil Mid-Month Consumer Price Index (CPI) YoY,brazilian mid month cpi,https://www.investing.com/economic-calendar/brazilian-mid-month-cpi-1570
1571,United States,United States PCE Prices,pce prices,https://www.investing.com/economic-calendar/pce-prices-1571
1572,Euro Zone,European Selling Price Expectations,european selling price expectations,https://www.investing.com/economic-calendar/european-selling-price-expectations-1572
1580,Singapore,Singapore URA Property Index QoQ,singapore ura property index,https://www.investing.com/economic-calendar/singapore-ura-property-index-1580
1585,United States,FOMC Member Williams Speaks,fomc member williams speaks,https://www.investing.com/economic-calendar/fomc-member-williams-speaks-1585
1633,Saudi Arabia,Saudi Arabia M3 Money Supply,saudi arabia m3 money supply,https://www.investing.com/economic-calendar/saudi-arabia-m3-money-supply-1633
1634,Saudi Arabia,Saudi Arabia Private Sector Loans,saudi arabia private sector loans,https://www.investing.com/economic-calendar/saudi-arabia-private-sector-loans-1634
1650,United States,U.S. Goods Trade Balance,goods trade balance,https://www.investing.com/economic-calendar/goods-trade-balance-1650
1652,United States,United States Baker Hughes Oil Rig Count,baker hughes u.s. rig count,https://www.investing.com/economic-calendar/baker-hughes-u.s.-rig-count-1652
1654,New Zealand,New Zealand GlobalDairyTrade Price Index,globaldairytrade price index,https://www.investing.com/economic-calendar/globaldairytrade-price-index-1654
1676,United Kingdom,BoE Quarterly Bulletin,boe quarterly bulletin,https://www.investing.com/economic-calendar/boe-quarterly-bulletin-1676
1688,Switzerland,Swiss National Bank Press Conference,snb press conference,https://www.investing.com/economic-calendar/snb-press-conference-1688
1689,Switzerland,Swiss National Bank Monetary Policy Assessment,snb monetary policy assessment,https://www.investing.com/economic-calendar/snb-monetary-policy-assessment-1689
1712,United States,U.S. Federal Reserve (Fed) Member Bostic Speaks,fomc member bostic speaks,https://www.investing.com/economic-calendar/fomc-member-bostic-speaks-1712
1713,Canada,Canada Common Consumer Price Index (CPI) YoY,common cpi,https://www.investing.com/economic-calendar/common-cpi-1713
1714,Canada,Canada Median Consumer Price Index (CPI) YoY,median cpi,https://www.investing.com/economic-calendar/median-cpi-1714
1715,Canada,Canada Trimmed Consumer Price Index (CPI) YoY,trimmed cpi,https://www.investing.com/economic-calendar/trimmed-cpi-1715
1720,United Kingdom,Bank of England (BoE) MPC Member Tenreyro Speaks,boe mpc member tenreyro speaks,https://www.investing.com/economic-calendar/boe-mpc-member-tenreyro-speaks-1720
1721,Australia,Reserve Bank of Australia (RBA) Assist Gov Bullock Speaks,rba assist gov bullock speaks,https://www.investing.com/economic-calendar/rba-assist-gov-bullock-speaks-1721
1729,Switzerland,Swiss National Bank (SNB) Governor Board Member Maechler Speaks,snb gov board member maechler speaks,https://www.investing.com/economic-calendar/snb-gov-board-member-maechler-speaks-1729
1738,United States,United States Federal Reserve Chair Powell Speaks,fed chair powell speaks,https://www.investing.com/economic-calendar/fed-chair-powell-speaks-1738
1739,United States,United States Federal Reserve Chair Powell Testifies,fed chair powell testifies,https://www.investing.com/economic-calendar/fed-chair-powell-testifies-1739
1741,Germany,German Bundesbank Monthly Report,german buba monthly report,https://www.investing.com/economic-calendar/german-buba-monthly-report-1741
1757,Japan,Bank of Japan (BoJ) Summary of Opinions,boj summary of opinions,https://www.investing.com/economic-calendar/boj-summary-of-opinions-1757
1759,France,France Consumer Price Index (CPI) YoY,french cpi,https://www.investing.com/economic-calendar/french-cpi-1759
1783,Brazil,Central Bank of Brazil (BCB) Inflation Report,bcb inflation report,https://www.investing.com/economic-calendar/bcb-inflation-report-1783
1784,Brazil,Central Bank of Brazil (BCB) Focus Market Readout,bcb focus market readout,https://www.investing.com/economic-calendar/bcb-focus-market-readout-1784
1785,Brazil,Central Bank of Brazil (BCB) Monetary Policy Committee (Copom) Meeting Minutes,bcb copom meeting minutes,https://www.investing.com/economic-calendar/bcb-copom-meeting-minutes-1785
1790,Euro Zone,Vice-President of the European Central Bank (ECB) Luis De Guindos Speaks,ecb's de guindos speaks,https://www.investing.com/economic-calendar/ecb's-de-guindos-speaks-1790
1801,United States,United States 8-Week Bill Auction,8 week bill auction,https://www.investing.com/economic-calendar/8-week-bill-auction-1801
1810,United States,United States Baker Hughes Total Rig Count,u.s. baker hughes total rig count,https://www.investing.com/economic-calendar/u.s.-baker-hughes-total-rig-count-1810
1822,Switzerland,Swiss National Bank (SNB) Quarterly Bulletin,snb quarterly bulletin,https://www.investing.com/economic-calendar/snb-quarterly-bulletin-1822
1824,South Korea,Bank of Korea (BOK) Financial Stability Board (FSB) Meeting Minutes,bok financial stability board meeting minutes,https://www.investing.com/economic-calendar/bok-financial-stability-board-meeting-minutes-1824
1829,India,Reserve Bank of India (RBI) Monetary and Credit Information Review,rbi monetary and credit information review,https://www.investing.com/economic-calendar/rbi-monetary-and-credit-information-review-1829
1830,South Africa,South African Reserve Bank (SARB) Quarterly Bulletin,sarb quarterly bulletin,https://www.investing.com/economic-calendar/sarb-quarterly-bulletin-1830
1837,Euro Zone,European Central Bank (ECB) Enria Speaks,ecb's enria speaks,https://www.investing.com/economic-calendar/ecb's-enria-speaks-1837
1851,Vietnam,Vietnam Consumer Price Index (CPI) YoY,vietnamese cpi,https://www.investing.com/economic-calendar/vietnamese-cpi-1851
1853,Vietnam,Vietnam Gross Domestic Product (GDP) YoY,vietnamese gdp,https://www.investing.com/economic-calendar/vietnamese-gdp-1853
1854,Vietnam,Vietnam Retail Sales YoY,vietnamese retail sales,https://www.investing.com/economic-calendar/vietnamese-retail-sales-1854
1856,Vietnam,Vietnam Industrial Production YoY,vietnamese industrial production,https://www.investing.com/economic-calendar/vietnamese-industrial-production-1856
1857,Vietnam,Vietnam Foreign direct investment (USD),vietnamese foreign direct investment (usd),https://www.investing.com/economic-calendar/vietnamese-foreign-direct-investment-(usd)-1857
1870,Philippines,Philippines Producer Price Index (PPI) YoY,philippines ppi,https://www.investing.com/economic-calendar/philippines-ppi-1870
1877,Brazil,Brazilian Producer Price Index MoM,brazilian ppi,https://www.investing.com/economic-calendar/brazilian-ppi-1877
1886,Russia,Russia Real Wage Growth YoY,russian real wage growth,https://www.investing.com/economic-calendar/russian-real-wage-growth-1886
1887,United States,United States Retail Inventories Excluding Auto,retail inventories ex auto,https://www.investing.com/economic-calendar/retail-inventories-ex-auto-1887
1891,Germany,Germany Car Registration MoM,german car registration,https://www.investing.com/economic-calendar/german-car-registration-1891
1892,Germany,Germany Car Registration YoY,german car registration,https://www.investing.com/economic-calendar/german-car-registration-1892
1896,Euro Zone,European Construction Output MoM,construction output,https://www.investing.com/economic-calendar/construction-output-1896
1897,Euro Zone,European Consumer Price Index Not Seasonally Adjusted,"cpi, n.s.a","https://www.investing.com/economic-calendar/cpi,-n.s.a-1897"
1900,Euro Zone,European Harmonised Index of Consumer Prices excluding Energy and Food YoY,hicp ex energy   food,https://www.investing.com/economic-calendar/hicp-ex-energy---food-1900
1901,Euro Zone,European Loans to Non Financial Corporations,non financial corporations loans,https://www.investing.com/economic-calendar/non-financial-corporations-loans-1901
1908,Japan,Japan Tokyo Consumer Price Index Excluding Food and Energy,tokyo cpi ex food and energy,https://www.investing.com/economic-calendar/tokyo-cpi-ex-food-and-energy-1908
1913,China,China Composite Purchasing Managers' Index,chinese composite pmi,https://www.investing.com/economic-calendar/chinese-composite-pmi-1913
1917,China,China Industrial profit Year to Date,chinese industrial profit ytd,https://www.investing.com/economic-calendar/chinese-industrial-profit-ytd-1917
1922,Italy,Italy Car Registration MoM,italian car registration,https://www.investing.com/economic-calendar/italian-car-registration-1922
1923,Italy,Italy Car Registration YoY,italian car registration,https://www.investing.com/economic-calendar/italian-car-registration-1923
1927,France,France Car Registration MoM,french car registration,https://www.investing.com/economic-calendar/french-car-registration-1927
1928,France,France Car Registration YoY,french car registration,https://www.investing.com/economic-calendar/french-car-registration-1928
1931,United Kingdom,United Kingdom Car Registration MoM,car registration,https://www.investing.com/economic-calendar/car-registration-1931
1932,United Kingdom,United Kingdom Car Registration YoY,car registration,https://www.investing.com/economic-calendar/car-registration-1932
1933,United Kingdom,United Kingdom Consumer Price Index Not Seasonally Adjusted,"cpi, n.s.a","https://www.investing.com/economic-calendar/cpi,-n.s.a-1933"
1935,United Kingdom,United Kingdom Core Consumer Price Index MoM,core cpi,https://www.investing.com/economic-calendar/core-cpi-1935
1965,Euro Zone,European Central Bank (ECB) President Lagarde Speaks,ecb president lagarde speaks,https://www.investing.com/economic-calendar/ecb-president-lagarde-speaks-1965
1967,China,People's Bank of China Loan Prime Rate,pboc loan prime rate,https://www.investing.com/economic-calendar/pboc-loan-prime-rate-1967
1971,Euro Zone,European Central Bank (ECB) Lane Speaks,ecb's lane speaks,https://www.investing.com/economic-calendar/ecb's-lane-speaks-1971
1975,United Kingdom,Bank of England (BoE) Governor Bailey Speaks,boe gov bailey speaks,https://www.investing.com/economic-calendar/boe-gov-bailey-speaks-1975
1976,Euro Zone,European Central Bank (ECB) Panetta Speaks,ecb's panetta speaks,https://www.investing.com/economic-calendar/ecb's-panetta-speaks-1976
1982,Euro Zone,European Central Bank (ECB) Schnabel Speaks,ecb's schnabel speaks,https://www.investing.com/economic-calendar/ecb's-schnabel-speaks-1982
1983,United States,United States 20-Year Bond Auction,20 year bond auction,https://www.investing.com/economic-calendar/20-year-bond-auction-1983
1984,United States,U.S. Federal Reserve (Fed) Bank Stress Test Results,fed bank stress test results,https://www.investing.com/economic-calendar/fed-bank-stress-test-results-1984
1991,Japan,Bank of Japan (BoJ) Board Member Seiji Adachi Speaks,boj board member adachi speaks,https://www.investing.com/economic-calendar/boj-board-member-adachi-speaks-1991
1994,Euro Zone,We're temporarily down for maintenance; Please check back soon...,ecb mccaul speaks,https://www.investing.com/economic-calendar/ecb-mccaul-speaks-1994
1996,Germany,German Bundesbank (Buba) Balz Speaks,german buba balz speaks,https://www.investing.com/economic-calendar/german-buba-balz-speaks-1996
1997,United States,United States Federal Reserve Waller Speaks,fed waller speaks,https://www.investing.com/economic-calendar/fed-waller-speaks-1997
2008,Brazil,Brazil Gross Debt-to-GDP ratio,gross debt to gdp ratio,https://www.investing.com/economic-calendar/gross-debt-to-gdp-ratio-2008
2011,United Kingdom,Bank of England (BoE) MPC Member Pill Speaks,boe mpc member pill speech,https://www.investing.com/economic-calendar/boe-mpc-member-pill-speech-2011
2015,Germany,German Bundesbank (Buba) President Nagel Speaks,german buba president nagel speech,https://www.investing.com/economic-calendar/german-buba-president-nagel-speech-2015
2018,Canada,Bank of Canada (BoC) Deputy Gov Kozicki Speaks,boc deputy gov kozicki speech,https://www.investing.com/economic-calendar/boc-deputy-gov-kozicki-speech-2018
2019,Japan,Bank of Japan (BoJ) Board Member Noguchi Speaks,boj board member noguchi speech,https://www.investing.com/economic-calendar/boj-board-member-noguchi-speech-2019
2029,Ghana,Ghana Producer Price Index (PPI) YoY,ppi,https://www.investing.com/economic-calendar/ppi-2029
2121,Germany,Germany North Rhine Westphalia CPI MoM,north rhine westphalia cpi,https://www.investing.com/economic-calendar/north-rhine-westphalia-cpi-2121
2122,Germany,Germany North Rhine Westphalia CPI YoY,north rhine westphalia cpi,https://www.investing.com/economic-calendar/north-rhine-westphalia-cpi-2122
2123,Germany,Germany Hesse CPI MoM,hesse cpi,https://www.investing.com/economic-calendar/hesse-cpi-2123
2124,Germany,Germany Hesse CPI YoY,hesse cpi,https://www.investing.com/economic-calendar/hesse-cpi-2124
2125,Germany,Germany Bavaria CPI YoY,bavaria cpi,https://www.investing.com/economic-calendar/bavaria-cpi-2125
2126,Germany,Germany Bavaria CPI MoM,bavaria cpi,https://www.investing.com/economic-calendar/bavaria-cpi-2126
2127,Germany,Germany Saxony CPI YoY,saxony cpi,https://www.investing.com/economic-calendar/saxony-cpi-2127
2128,Germany,Germany Brandenburg CPI YoY,brandenburg cpi,https://www.investing.com/economic-calendar/brandenburg-cpi-2128
2129,Germany,Germany Brandenburg CPI MoM,brandenburg cpi,https://www.investing.com/economic-calendar/brandenburg-cpi-2129
2130,Germany,Germany Baden Wuerttemberg CPI MoM,baden wuerttemberg cpi,https://www.investing.com/economic-calendar/baden-wuerttemberg-cpi-2130
2131,Germany,Germany Baden Wuerttemberg CPI YoY,baden wuerttemberg cpi,https://www.investing.com/economic-calendar/baden-wuerttemberg-cpi-2131
2132,Germany,Germany Saxony CPI MoM,saxony cpi,https://www.investing.com/economic-calendar/saxony-cpi-2132
2140,United Kingdom,Dr. Swati Dhingra is an Associate Professor at the London School of Economics. She is an elected member of the Council of the Royal Economic Society.,boe mpc member dhingra speaks,https://www.investing.com/economic-calendar/boe-mpc-member-dhingra-speaks-2140
2143,Canada,"It's a detailed record of the BOC's Governing Council's most recent meeting, providing in-depth insights into the economic conditions that influenced",boc summary of deliberations,https://www.investing.com/economic-calendar/boc-summary-of-deliberations-2143
2152,Czech Republic,Czech Republic Car Registration,car registration,https://www.investing.com/economic-calendar/car-registration-2152
2153,Czech Republic,Czech Republic Car Registration,car registration,https://www.investing.com/economic-calendar/car-registration-2153
2162,Hungary,Hungary Car Registration,car registration,https://www.investing.com/economic-calendar/car-registration-2162
2163,Hungary,Hungary Car Registration,car registration,https://www.investing.com/economic-calendar/car-registration-2163
2166,Netherlands,Netherlands Car Registration,netherlands car registration,https://www.investing.com/economic-calendar/netherlands-car-registration-2166
2167,Netherlands,Netherlands Car Registration,netherlands car registration,https://www.investing.com/economic-calendar/netherlands-car-registration-2167
2168,Poland,Poland Car Registration,car registration,https://www.investing.com/economic-calendar/car-registration-2168
2169,Poland,Poland Car Registration,car registration,https://www.investing.com/economic-calendar/car-registration-2169
